{
  "$schema": "http://json-schema.org/draft-07/schema#",
  "$id": "https://rjp.local/protocol/schemas/case_object.schema.json",
  "title": "CaseObject",
  "type": "object",
  "additionalProperties": false,
  "required": [
    "schema_version",
    "case_id",
    "domain_id",
    "subject_scope",
    "target_scope",
    "observation_window",
    "claim_type",
    "extractor_version",
    "evidence_root",
    "evidence_manifest_hash",
    "evidence_manifest_item_count",
    "evidence_manifest",
    "evidence_anchor",
    "feature_summary",
    "created_at",
    "source_reference"
  ],
  "properties": {
    "schema_version": {
      "const": "rjp.case_object.v1"
    },
    "case_id": {
      "type": "string",
      "minLength": 1
    },
    "domain_id": {
      "type": "string",
      "minLength": 1
    },
    "subject_scope": {
      "type": "object",
      "additionalProperties": false,
      "required": [
        "subject_type",
        "subject_id"
      ],
      "properties": {
        "subject_type": {
          "type": "string",
          "enum": [
            "wallet",
            "contract",
            "wallet_contract_pair",
            "wallet_protocol_pair"
          ]
        },
        "subject_id": {
          "type": "string",
          "pattern": "^0x[a-f0-9]{40}$"
        }
      }
    },
    "target_scope": {
      "type": "object",
      "additionalProperties": false,
      "required": [
        "target_type",
        "target_contract",
        "target_protocol",
        "target_context"
      ],
      "properties": {
        "target_type": {
          "type": "string",
          "enum": [
            "wallet",
            "contract",
            "wallet_contract_pair",
            "wallet_protocol_pair"
          ]
        },
        "target_contract": {
          "type": "string",
          "pattern": "^0x[a-f0-9]{40}$"
        },
        "target_protocol": {
          "type": "string",
          "minLength": 1
        },
        "target_context": {
          "type": "object"
        }
      }
    },
    "observation_window": {
      "type": "object",
      "additionalProperties": false,
      "required": [
        "source_network",
        "source_chain_id",
        "observed_from_block",
        "observed_to_block",
        "observed_from_block_hash",
        "observed_to_block_hash",
        "selection_mode"
      ],
      "properties": {
        "source_network": {
          "type": "string",
          "minLength": 1
        },
        "source_chain_id": {
          "type": "integer",
          "minimum": 1
        },
        "observed_from_block": {
          "type": "integer",
          "minimum": 0
        },
        "observed_to_block": {
          "type": "integer",
          "minimum": 0
        },
        "observed_from_block_hash": {
          "type": "string",
          "pattern": "^0x[a-f0-9]{64}$"
        },
        "observed_to_block_hash": {
          "type": "string",
          "pattern": "^0x[a-f0-9]{64}$"
        },
        "selection_mode": {
          "type": "string",
          "enum": [
            "rolling_range",
            "pinned_range",
            "fixed_range"
          ]
        }
      }
    },
    "claim_type": {
      "type": "string",
      "minLength": 1
    },
    "extractor_version": {
      "type": "string",
      "minLength": 1
    },
    "evidence_root": {
      "type": "string",
      "pattern": "^0x[a-f0-9]{64}$"
    },
    "evidence_manifest_hash": {
      "type": "string",
      "pattern": "^0x[a-f0-9]{64}$"
    },
    "evidence_manifest_item_count": {
      "type": "integer",
      "minimum": 0
    },
    "evidence_manifest": {
      "type": "object",
      "additionalProperties": false,
      "required": [
        "schema_version",
        "selection_rule",
        "subject_id",
        "source",
        "window",
        "item_count",
        "leaf_hashes",
        "merkle_root",
        "items"
      ],
      "properties": {
        "schema_version": {
          "type": "string",
          "minLength": 1
        },
        "selection_rule": {
          "type": "string",
          "minLength": 1
        },
        "subject_id": {
          "type": "string",
          "pattern": "^0x[a-f0-9]{40}$"
        },
        "source": {
          "type": "object"
        },
        "window": {
          "type": "object"
        },
        "item_count": {
          "type": "integer",
          "minimum": 0
        },
        "leaf_hashes": {
          "type": "array",
          "items": {
            "type": "string",
            "pattern": "^0x[a-f0-9]{64}$"
          }
        },
        "merkle_root": {
          "type": "string",
          "pattern": "^0x[a-f0-9]{64}$"
        },
        "items": {
          "type": "array"
        }
      }
    },
    "evidence_anchor": {
      "type": "string",
      "minLength": 1
    },
    "feature_summary": {
      "type": "object",
      "additionalProperties": {
        "type": [
          "integer",
          "number",
          "string",
          "boolean"
        ]
      }
    },
    "created_at": {
      "type": "string",
      "pattern": "^\\d{4}-\\d{2}-\\d{2}T\\d{2}:\\d{2}:\\d{2}Z$"
    },
    "notes": {
      "type": "string"
    },
    "source_reference": {
      "type": "object",
      "additionalProperties": false,
      "required": [
        "domain_spec_hash",
        "evidence_policy_hash"
      ],
      "properties": {
        "domain_spec_hash": {
          "type": "string",
          "pattern": "^0x[a-f0-9]{64}$"
        },
        "evidence_policy_hash": {
          "type": "string",
          "pattern": "^0x[a-f0-9]{64}$"
        }
      }
    }
  }
}
