{
  "schema_version": "rjp.case_object.v1",
  "case_id": "counterparty_trust.base_trade_v1:0x3d1539c26aabce1b1aca28fb9d8fd70670391d5c:39450000-39454664",
  "domain_id": "counterparty_trust.base_trade_v1",
  "subject_scope": {
    "subject_type": "wallet",
    "subject_id": "0x3d1539c26aabce1b1aca28fb9d8fd70670391d5c"
  },
  "target_scope": {
    "target_type": "wallet_contract_pair",
    "target_contract": "0x4200000000000000000000000000000000000006",
    "target_protocol": "erc20",
    "target_context": {
      "action_type": "trade",
      "asset_symbol": "WETH",
      "spender": "0x4200000000000000000000000000000000000006"
    }
  },
  "observation_window": {
    "source_network": "base-sepolia",
    "source_chain_id": 84532,
    "observed_from_block": 39450000,
    "observed_to_block": 39454664,
    "observed_from_block_hash": "0x1111111111111111111111111111111111111111111111111111111111111111",
    "observed_to_block_hash": "0x2222222222222222222222222222222222222222222222222222222222222222",
    "selection_mode": "pinned_range"
  },
  "claim_type": "counterparty_trade_readiness",
  "extractor_version": "base_counterparty_trade_case.v1",
  "evidence_root": "0x3333333333333333333333333333333333333333333333333333333333333333",
  "evidence_manifest_hash": "0x4444444444444444444444444444444444444444444444444444444444444444",
  "evidence_manifest_item_count": 3,
  "evidence_manifest": {
    "schema_version": "rjp.base_manifest.v1",
    "selection_rule": "all_outgoing_subject_transactions_in_window",
    "subject_id": "0x3d1539c26aabce1b1aca28fb9d8fd70670391d5c",
    "source": {
      "network": "base-sepolia",
      "chain_id": 84532
    },
    "window": {
      "start_block": 39450000,
      "end_block": 39454664,
      "start_block_hash": "0x1111111111111111111111111111111111111111111111111111111111111111",
      "end_block_hash": "0x2222222222222222222222222222222222222222222222222222222222222222"
    },
    "item_count": 3,
    "leaf_hashes": [
      "0xaaaaaaaaaaaaaaaaaaaaaaaaaaaaaaaaaaaaaaaaaaaaaaaaaaaaaaaaaaaaaaaa",
      "0xbbbbbbbbbbbbbbbbbbbbbbbbbbbbbbbbbbbbbbbbbbbbbbbbbbbbbbbbbbbbbbbb",
      "0xcccccccccccccccccccccccccccccccccccccccccccccccccccccccccccccccc"
    ],
    "merkle_root": "0x3333333333333333333333333333333333333333333333333333333333333333",
    "items": []
  },
  "evidence_anchor": "base-sepolia:39450000-39454664:0x3d1539c26aabce1b1aca28fb9d8fd70670391d5c",
  "feature_summary": {
    "tx_count": 4,
    "failed_tx_count": 0,
    "unique_counterparties": 1,
    "unbounded_approval_count": 1,
    "flagged_interaction_count": 0
  },
  "notes": "Window captures a high-risk approval pattern against the target trade contract.",
  "created_at": "2026-03-31T12:00:00Z",
  "source_reference": {
    "domain_spec_hash": "0x35f3f3b605d54f91ad87e327787208214eda4dc1e585b10b2dc0cff253de6dea",
    "evidence_policy_hash": "0xd0be88441e4411f1029dca72a9b3082736b09656bedc9246e07ca7d6e7a0935a"
  }
}
